{
  "version": "1.0.0-test",
  "updated_at": "2025-12-14T16:52:29.965Z",
  "tasks": [
    {
      "id": "T-ENF-008",
      "parent_id": null,
      "title": "Reword backlog escape hatch note",
      "description": "In BACKLOG.md, replace the note that mentions 'outputs code without creating files' with policy-reinforcing text that instructs to fix the underlying dispatcher issue via recursive decomposition rather than bypassing delegation.",
      "files_touched": [
        ".claude/BACKLOG.md"
      ],
      "est_lines_changed": 5,
      "est_local_effort_mins": 5,
      "test_command": "grep -q 'dispatcher integration bug' .claude/BACKLOG.md",
      "assigned_to": "local:qwen",
      "priority": "P0",
      "status": "pending",
      "inputs": [
        ".claude/BACKLOG.md"
      ],
      "outputs": [
        "Updated .claude/BACKLOG.md with policy-reinforcing note"
      ],
      "constraints": [
        "Find and replace note starting with '*Note: Local model delegation attempted...'",
        "Replace with: '*Note: If local model outputs code without creating files, this indicates a dispatcher integration bug that must be fixed per DECOMPOSITION_POLICY.md Section 9 (recursive decomposition). Do NOT bypass delegation - troubleshoot and fix the underlying issue.'",
        "Maintain markdown formatting",
        "Keep in same location (around line 70)"
      ],
      "assigned_at": "2025-12-12T16:56:36.102Z"
    },
    {
      "id": "T-017-combined",
      "title": "Create auto-execute-project.cjs with spec extraction and dispatcher integration",
      "description": "Create CLI script that reads project files, extracts task specs from <details> sections, converts to ///LOCAL_TASKS format, and pipes to dispatcher for execution",
      "files_touched": [
        "scripts/auto-execute-project.cjs"
      ],
      "est_lines_changed": 290,
      "est_local_effort_mins": 45,
      "test_command": "node scripts/auto-execute-project.cjs --help",
      "assigned_to": "local:deepseek",
      "priority": "P1",
      "status": "in_progress",
      "inputs": [
        "project name as CLI argument"
      ],
      "outputs": [
        "Executes all tasks from project file via dispatcher"
      ],
      "constraints": [
        "#!/usr/bin/env node shebang",
        "Accept project name as argument",
        "Find project file in docs/projects/",
        "Parse markdown <details> sections for ```json blocks",
        "Validate extracted JSON against local-task schema",
        "Convert to ///LOCAL_TASKS format",
        "Pipe to dispatcher.cjs add-tasks via child_process",
        "Call dispatcher.cjs assign-next for each task",
        "Report progress to console",
        "Handle errors gracefully"
      ],
      "needs_context": [
        {
          "path": "scripts/dispatcher.cjs",
          "lines_start": 111,
          "lines_end": 170
        },
        {
          "path": "scripts/dispatcher.cjs",
          "lines_start": 201,
          "lines_end": 303
        },
        {
          "path": ".claude/DECOMPOSITION_POLICY.md",
          "lines_start": 35,
          "lines_end": 68
        }
      ],
      "assigned_at": "2025-12-12T16:58:00.075Z"
    },
    {
      "id": "T-007",
      "title": "Write unit tests for pre-write-delegation-check.cjs",
      "description": "Write unit tests for pre-write blocking hook using node:test",
      "files_touched": [
        ".claude/hooks/__tests__/pre-write-delegation-check.test.js"
      ],
      "est_lines_changed": 150,
      "est_local_effort_mins": 40,
      "test_command": "node .claude/hooks/__tests__/pre-write-delegation-check.test.js",
      "assigned_to": "local:qwen",
      "priority": "P1",
      "status": "in_progress",
      "inputs": [
        "pre-write-delegation-check.cjs or delegation-check-pre.cjs"
      ],
      "outputs": [
        "Unit test file with 5+ test cases"
      ],
      "constraints": [
        "Use node:test (built-in test runner)",
        "Test: No active project → allows (exit 0)",
        "Test: File not in project → allows",
        "Test: File assigned to local model → blocks (exit 2)",
        "Test: File assigned to claude → allows",
        "Test: Error handling → allows (fail open)",
        "Mock file reads and stdin using node:test mocking",
        "Target file: .claude/hooks/delegation-check-pre.cjs (the complete version)"
      ],
      "needs_context": [
        {
          "path": ".claude/hooks/delegation-check-pre.cjs",
          "lines_start": 1,
          "lines_end": 316
        }
      ],
      "assigned_at": "2025-12-12T16:59:06.236Z"
    },
    {
      "id": "T-020-FIX",
      "title": "Rewrite DISPATCHER_QUICKSTART.md in proper markdown format",
      "description": "Replace the incorrectly generated JavaScript code with proper markdown documentation showing dispatcher workflow commands",
      "files_touched": [
        ".claude/DISPATCHER_QUICKSTART.md"
      ],
      "est_lines_changed": 180,
      "est_local_effort_mins": 25,
      "test_command": "grep -q '## Adding Tasks Manually' .claude/DISPATCHER_QUICKSTART.md",
      "assigned_to": "local:qwen",
      "priority": "P1",
      "status": "in_progress",
      "inputs": [
        "dispatcher.cjs commands",
        "enforcement project examples"
      ],
      "outputs": [
        "Markdown quickstart guide with sections and code blocks"
      ],
      "constraints": [
        "Pure markdown format (NOT JavaScript)",
        "Section 1: Adding tasks manually - show cat tasks.json | node scripts/dispatcher.cjs add-tasks",
        "Section 2: Executing tasks - show node scripts/dispatcher.cjs assign-next",
        "Section 3: Checking status - show node scripts/dispatcher.cjs status",
        "Section 4: Troubleshooting - common errors and fixes",
        "Include examples from local-model-enforcement project",
        "Use markdown code blocks with bash syntax highlighting",
        "Keep under 200 lines"
      ],
      "needs_context": [
        {
          "path": "scripts/dispatcher.cjs",
          "lines_start": 1,
          "lines_end": 60
        },
        {
          "path": ".claude/DECOMPOSITION_POLICY.md",
          "lines_start": 449,
          "lines_end": 463
        }
      ],
      "assigned_at": "2025-12-12T17:05:53.102Z"
    },
    {
      "id": "T-017-FIX",
      "title": "Fix auto-execute-project.cjs bugs and simplify implementation",
      "description": "Rewrite auto-execute-project.cjs without external dependencies (showdown/ajv), fix syntax errors, and implement proper task extraction from project files",
      "files_touched": [
        "scripts/auto-execute-project.cjs"
      ],
      "est_lines_changed": 150,
      "est_local_effort_mins": 40,
      "test_command": "node scripts/auto-execute-project.cjs --help",
      "assigned_to": "local:deepseek",
      "priority": "P1",
      "status": "in_progress",
      "inputs": [
        "Project markdown files with <details> sections"
      ],
      "outputs": [
        "Working CLI script that extracts and executes tasks"
      ],
      "constraints": [
        "NO external dependencies (remove showdown, ajv)",
        "Use Node.js built-in modules only (fs, path, child_process)",
        "Parse markdown using regex to find <details> sections",
        "Extract JSON from code blocks: ```json ... ```",
        "Use JSON.parse to validate (no ajv needed)",
        "Fix path resolution (use process.cwd() + 'docs/projects/')",
        "Add proper error handling",
        "Include --help flag showing usage",
        "Pipe to dispatcher via spawn/exec with proper stdin",
        "Test with: node scripts/auto-execute-project.cjs --help"
      ],
      "needs_context": [
        {
          "path": "scripts/dispatcher.cjs",
          "lines_start": 111,
          "lines_end": 170
        },
        {
          "path": "docs/projects/0.002.1212-local-model-enforcement.project.md",
          "lines_start": 130,
          "lines_end": 160
        }
      ],
      "assigned_at": "2025-12-12T17:06:11.226Z"
    },
    {
      "id": "T-DECOMP-001",
      "title": "Add Task Complexity Classification to DECOMPOSITION_POLICY.md",
      "description": "Add Section 2.5 defining Type A-D task complexity with guidelines for each type",
      "files_touched": [
        ".claude/DECOMPOSITION_POLICY.md"
      ],
      "est_lines_changed": 80,
      "est_local_effort_mins": 25,
      "test_command": "grep -q 'Type A: Mechanical Edit' .claude/DECOMPOSITION_POLICY.md",
      "assigned_to": "local:qwen",
      "priority": "P0",
      "status": "pending",
      "constraints": [
        "Insert new Section 2.5 after Section 2 (Atomic Criteria)",
        "Define 4 complexity types: Type A (Mechanical Edit), Type B (Template Fill), Type C (Creative Generation), Type D (Semantic Rewrite)",
        "For each type: describe characteristics, provide examples, specify when to use",
        "Add rule: Only Type A/B can be assigned to local models without escalation",
        "Keep formatting consistent with existing sections",
        "Use markdown headers, bullet points, and code examples"
      ],
      "needs_context": [
        {
          "path": ".claude/DECOMPOSITION_POLICY.md",
          "lines_start": 57,
          "lines_end": 90
        }
      ],
      "assigned_at": "2025-12-12T17:49:30.679Z"
    },
    {
      "id": "T-DECOMP-002",
      "title": "Extend local-task.schema.json with new optional fields",
      "description": "Add edit_strategy, edit_operations, output_template, anti_patterns to task schema",
      "files_touched": [
        ".claude/schemas/local-task.schema.json"
      ],
      "est_lines_changed": 120,
      "est_local_effort_mins": 35,
      "test_command": "node -e \"const s=require('./.claude/schemas/local-task.schema.json'); if(!s.properties.edit_strategy) process.exit(1);\"",
      "assigned_to": "local:deepseek",
      "priority": "P0",
      "status": "pending",
      "constraints": [